Institución;Titulo;Autor;Grado;Asesor(es);Resumen;Año
Universidad César Vallejo;EFECTO DE PROPORCIONES DE TARWI (Lupinus mutabilis S.) SOBRE LAS CARACTERÍSTICAS SENSORIALES, REOLÓGICAS Y  FISICOQUÍMICAS DE UNA SALSA DE ROCOTO (Capsicum pubescens)”;Mendez Samana, Vany Margarita;Ingeniero Agroindustrial;Linares Lujan, Guillermo Alberto;"e investigó el efecto de proporciones de tarwi (Lupinus mutabilis S.) sobre las
características sensoriales, reológicas y fisicoquímicas de una salsa de rocoto
(Capsicum pubescens). En las características sensoriales entre los tratamientos se
utilizó una escala hedónica de 9 puntos, por parte de la aceptabilidad general
presentaron calificaciones de “ni me gusta ni me disgusta” de la muestra patrón del 0%
de Tarwi, “me gusta ligeramente” de la muestras del tratamiento que contiene 5% y
10% de Tarwi y “ me gusta” del tratamiento que contiene un 15% de Tarwi, en la
aceptabilidad de color en los tratamientos presento “ me gusta” por los tratamientos
que contienen Tarwi y “me gusta ligeramente” por la muestra patrón que no contiene
Tarwi y por parte de la textura presentación una calificación de “ me gusta” por todos
los tratamientos. En las características reológicas de la salsa de rocoto se utilizó un
viscosímetro digital de marca Fungilab Expert. En todos los tratamientos, la viscosidad
aparente disminuyó con la velocidad de cizalla demostrando un comportamiento “no
newtoniano” de tipo “plástico general”. La índice consistencia estuvo en el rango de
0.7133 y 0.8745 (n &lt; 1), el índice de comportamiento “k” en el rango de 4.1143 y 4.7249
Pa.sn , tensión de fluencia en el rango de 7.0620 y 8.989 Pa y finalmente, las
características fisicoquímicas de la salsa se obtuvo una acidez entre 1.038% a 1.054%
y un pH entre 3.850 a 3.963.";2017
Universidad César Vallejo;Efecto De La Temperatura Y Tiempo De Extracción, En El Rendimiento Y Fuerza Del Gel De Pectina Extraída De Borras Desechadas En El Proceso De Clarificación Durante La Elaboración De Vino Blanco;Rodríguez Iglesias, Cynthia Estefany;Ingeniero Agroindustrial;Barraza Jáuregui Gabriela del Carmen;"Se evaluó el  efecto de la temperatura y tiempo de extracción, en el rendimiento y fuerza de gel de pectina  extraída de borras desechadas en el proceso de clarificación durante la elaboración de vino blanco. La población estuvo conformada por 12 ensayos (4 tratamientos y 3 repeticiones), las cuales se evaluaron en su totalidad los parámetros rendimiento y fuerza de gel. Un análisis de varianza se usó para evaluar el efecto de dos temperaturas (85 y 95 °C) y tiempos de extracción (50 y 70 min) sobre el rendimiento de pectinas extraídas y su fuerza de gel. La comparación de medias fue hecha con el test de Duncan. El rendimiento no se encontró afectado por la temperatura y tiempo de extracción, ya que no presentó efecto significativo (p&gt;0.05), caso contrario ocurrió con la temperatura de extracción sobre la fuerza del gel de pectina extraída de borras desechadas en el proceso de clarificación durante la elaboración de vino blanco. El rendimiento obtenido fue  entre 1.07  y 1.27 % de pectina extraída de borras de vino blanco. El mejor tratamiento fue a una temperatura de 95 °C y tiempo de 50 min para obtener mayor valor de fuerza de gel (1.13) de pectina extraída de borras.";2014
Universidad César Vallejo;Estimación De La Vida Útil De Salsa De Persea Americana Mill (Palta) Var. Hass Envasada Al Vacío, Mediante Pruebas Aceleradas;Morillas Reynaga, Mariethe Norminha;Ingeniero Agroindustrial;Barraza Jáuregui Gabriela del Carmen;"El objetivo de esta investigación fue estimar la vida útil de una salsa de Persea americana Mill (Palta) var. Hass envasada al vacío, mediante pruebas aceleradas en función a la aceptabilidad general. El producto se almacenó a 5, 10 y 15 °C, durante 20 días. Se realizaron muestreos cada cinco días para cada temperatura en donde se evaluó el índice de pardeamiento (color), recuento de mohos y levaduras y la aceptabilidad general reclutando a 30 panelistas no entrenados (consumidores).
Los resultados indicaron que no existió efecto significativo sobre las evaluaciones del recuento de

mohos y levaduras, pero si existió efecto sobre el índice de pardeamiento (análisis de color)y en la aceptabilidad general (grado de satisfacción del producto).
El tiempo de vida útil se determinó mediante pruebas aceleradas, almacenando las muestras a las temperaturas de 5, 10 y 15 °C, evaluando la cinética de deterioro en función a la aceptabilidad general, que siguió una reacción de orden cero. El efecto de la temperatura se evaluó con la ecuación de Arrhenius, obteniéndose un valor de Energía de activación (Ea) de 39,36 kJ/mol. El tiempo de vida útil estimado de la salsa de Persea americana Mill (Palta) var. Hass envasada al vacío fue de 33.69 días a la temperatura de almacenamiento de 2 °C. El análisis estadístico se realizó empleando el software XLSTAT 2014.";2014
Universidad César Vallejo;Efecto De La Proporción De Viruta De Pinus Sylvestris L., Viruta De Eucalyptus Globulus L. Y Coronta De Zea Mays, En La Formulación De Sustratos, Sobre La Capacidad Productiva De Pleurotus Ostreatus.;García Quezada, Jorge Armando;Ingeniero Agroindustrial;Miano Pastor, Alberto Claudio;"El presente trabajo de investigación tuvo por objetivo evaluar el efecto de la proporción de viruta de Pinus sylvestris L, viruta de Eucalyptus globulus L, y coronta de Zea mays en la formulación de sustratos, sobre la capacidad productiva (Rendimiento, Eficiencia Biológica y Tasa de Producción) de Pleurotus ostreatus, para lo cual se empleó un Diseño Simplex con Centroide Ampliado realizándose un total de 10 tratamientos, tomando rangos entre 0 a 100 % p/p de cada sustrato. Se aplicó un análisis de varianza (ANOVA) encontrándose diferencia significativa (p&lt;0,05) entre los tratamiento y demostrando que la viruta de Eucalyptus globulus disminuye la capacidad productiva de Pleurotus ostreatus.  Se optimizó la mezcla de sustratos para obtener la máxima capacidad productiva, la cual fue 93,43% de viruta de Pinus sylvestris, 6,57% de coronta de Zea mays y 0% de viruta de Eucalyptus globulus L, obteniendo 18,18% de rendimiento, 50,05% de eficiencia biológica y 139,04% de tasa de producción. Finalmente se obtuvo un modelo correspondiente para cada variable dependiente (R2&gt;0.98) el cual tiene como utilidad la predicción de la capacidad productiva al utilizar los sustratos empleados en la presente investigación.";2014
Universidad César Vallejo;Efecto De La Concentración De Albumina De Huevo Y Tiempo De Batido En Las Características Físicas De Espuma De Pulpa De Sauco  (Sambucus Nigra) Con Fines De Deshidratación.;Cuccaro Arrieta, Miguel Alfredo;Ingeniero Agroindustrial;Barraza Jáuregui Gabriela del Carmen;"El  presente trabajo  de investigación  tuvo  por objetivo  evaluar  el  efecto de  la concentración  de albumina de huevo y tiempo de batido en las características físicas de la espuma (estabilidad, expansión) de pulpa de sauco (Sambucus nigra) para fines de deshidratación, para lo cual se empleó albumina de huevo como agente espumante; a concentraciones de 5-15% y tiempos de batido de
5-15% como niveles mínimos y máximos. Se realizó 13 tratamientos provenientes del diseño experimental de superficie de respuesta con diseño central compuesto rotacional.

Se aplicó un análisis de varianza (ANOVA) encontrándose diferencia significativa (p&lt;0,05), se obtuvo un R2 de 88.44% para la variable expansión y un R2  76.27% para la variable estabilidad, de lo cual se observa que el modelo sólo describe el fenómeno producido por la expansión de espuma. Dicha variable se optimizó para obtener los mejores resultados. Para expansión de espuma se tomaron como valores óptimos en concentración de albumina 16.58 % p/p y en tiempo de batido 10.94 min. La predicción para la óptima combinación fue de 415.25 % de expansión de espuma; dado que en estadística se trabaja con un intervalo de confianza del 95% tendremos dos límites: el inferior de
381. 29 % y el superior de 449.22 % de expansión de espuma. Finalmente mediante una prueba experimental se logró confirmar dichas predicciones validando correctamente la variable expansión de espuma.";2014
Universidad César Vallejo;Efecto De La Proporción De Pulpa De Zanahoria (Daucus Carota L.) En Las Características Físicoquímicas Y Aceptabilidad General De Un Helado Tipo Crema;García Cabrera, José Alexander;Ingeniero Agroindustrial;Pagador Flores, Sandra Elizabeth;"El presente trabajo de investigación tuvo por finalidad evaluar el efecto de la proporción de pulpa de zanahoria en las características fisicoquímicas y sensoriales de un helado tipo crema. Se tuvo como variable independiente a la proporción de pulpa de zanahoria (10, 20 y 30%) y     como variables dependientes paramétricas al overrun, pH, acidez, °Brix, contenido de proteína y grasa evaluados mediante un diseño de bloques completamente aleatorizados; sensorialmente para la textura los tratamientos se evaluaron mediante una prueba de ordenamiento de menor a mayor percepción  de  granulosidad,  y  una  prueba  afectiva  para  aceptabilidad  general,  donde  los panelistas ponderaron el nivel de agrado o desagrado de los tratamientos de helado tipo crema, para el análisis de datos sensoriales se usó la prueba de Friedman y Wilcoxon. Se determinó la existencia de efecto significativo (p&lt;0.05) de la proporción de pulpa de zanahoria sobre los °Brix y textura sensorial, caso contrario ocurrió para overrun, pH, acidez, contenido de proteína y grasa y aceptabilidad general. Se determinó que con una proporción de pulpa de zanahoria al 30% los parámetros  de pH, acidez, °Brix, contenido de grasa  y  proteína  se encontraron dentro de  los requisitos de la norma técnica peruana para helados tipo crema, además, hasta con este nivel de proporción la aceptabilidad general no presentó cambios considerables, se obtuvo la moda más alta de 9 puntos correspondiente a la percepción de “me agrada muchísimo” y en textura sensorial los tratamientos fueron ordenados como “más granulosos”.";2015
Universidad César Vallejo;Caracterización Fisicoquimica Y Reologica De Almidon De Arracacha (Arracacia Xanthorrhiza) Variedad Amarilla Procedente De La Provincia San Ignacio-Departamento De Cajamarca.;Alayo Sánchez, Brenda del Pilar;Ingeniero Agroindustrial y Comercio Exterior;Leon Marrou, Maria Elena;"En este trabajo de investigación se caracterizó las propiedades fisicoquímicas y reológicas del almidón de la arracacha (Arracacia xanthorrhiza) variedad amarilla procedente de la provincia de San Ignacio-Departamento de Cajamarca. Se extrajo el almidón y se evaluó su rendimiento, sus propiedades fisicoquímicas y reológicas. Los resultados obtenidos indican que el almidón presentó un rendimiento de 11.1%, con un contenido de humedad de 4.71 %, 0.27 % de cenizas, amilosa 15.16% y amilopectina 84.84%.Los gránulos de almidón mostraron en su gran mayoría formas poliédricas, con tamaños de 7 a 25μm.Además, presentó un índice de absorción de agua 16.03 g gel/ g muestra,   una baja solubilidad de 15.36 % y un poder de hinchamiento alto de 16.23 g agua. g–1 almidón. La temperatura de gelatinización del almidón es de 65.3 ºC, se observó una sinéresis a las 24 h 6.35 % y a las 48 h 6.9 %. Las suspensiones al 5% de almidón de la arracacha (Arracacia xanthorrhiza) variedad amarilla pre gelatinizado exhibieron un comportamiento de fluido no Newtoniano de tipo plástico general con esfuerzo cortante ד(0) 5.08 Pa., índice de comportamiento de
flujo de 0.61 e índice de consistencia m de 3.95 Pa.s";2015
Universidad César Vallejo;Estudio Económico Para La Instalación De Una Planta Procesadora De Panela Orgánica Y Su Impacto En La Economía De Los Agricultores Del Distrito De Cumba, Provincia Utcubamba, Región Amazonas (2015);Loaiza Colunche, Evert;Ingeniero Agroindustrial;Sánchez González, Jesús Alexander;"La agroindustria panelera en Perú se está desarrollando a pasos agigantados, principalmente en la Región Amazonas. En tal sentido, es importante conocer al detalle el proceso de producción de panela granulada y panela sólida, desarrollando tecnología local que permita hacer frente a los retos que involucran dicha agroindustria, por lo que, en el presente trabajo de investigación se ha diseñado una propuesta para la instalación de una planta procesadora de panela orgánica, en el Distrito de Cumba, Provincia de Utcubamba en la Región Amazonas,  iniciando con el estudio de mercado;  la  localización  y  tamaño  de  planta;  la  ingeniería  del  proyecto  que  consta  con  el diagrama de flujo de proceso, especificaciones de equipos, mano de obra, distribución de planta y especificación del terreno y construcción; luego se continuó con el balance de materia; estudio de impacto ambiental; estudio organizacional; estudio económico y financiero; conclusiones y recomendaciones.

La  necesidad  de  financiamiento  es  de  $  63259.31,  cuyas  fuentes  de  financiamiento  para  la inversión inicial (90%) tenemos   Fondo de Investigación y Desarrollo para la Competitividad (FIDECOM), liderado por el Ministerio de la Producción: El PIPEA (Proyectos de Innovación Productiva); El PIPEI (Proyectos de Innovación Productiva para Empresas Individuales) y El PIMEN (Proyectos Menores de Innovación Productiva); el 10% es capital propio y el capital de trabajo estará financiado por el Banco Continental. El proyecto es muy rentable, considerando una tasa de descuento del 14% obtenemos un VAN (valor actual neto) de S/. 746586.26 y un TIR (tasa interna de retorno) de 3583%, con un Periodo de recuperación de capital (PRC) de 2.41 años; Relación Beneficio/costo es de 1.60. Una buena sensibilidad del precio al reducir el precio hasta $
500 la tonelada de panela obtenemos un VAN de S/. 150085.13 y un TIR de 132%; no obstante si consideramos la demanda es 10% menos de lo que se prevé con un precio de $ 500 la tonelada de panela se tiene un VAN de S/. 32746.43 y un TIR de 32%, lo que indica muy buena rentabilidad.
De acuerdo a la perspectiva de los agricultores, la instalación de la planta panelera tendrá un impacto positivo en su economía.";2015
