Institución;Titulo;Autor;Grado;Asesor(es);Resumen;Año
Universidad César Vallejo;Efecto del nitrofoska verde y suero de leche como medios de cultivo en la producción de biomasa de Scenedesmus acuminatum IMP-LBA-008, en fotobiorreactor de tanque agitado;Díaz Aponte, Gerson Moisés;Ingeniero Agroindustrial;Pagador Flores, Sandra Elizabeth;"Este trabajo tuvo por objeto determinar el efecto del Nitrofoska verde y suero de leche como
medios de cultivo en la producción de Biomasa de Scenedesmus acuminatum IMP-LBA-008,
en fotobiorreactor de tanque agitado.
El cultivo de las microalgas se realizó en seis fotobiorreactores, los cuales tuvieron como
medio de cultivo Nitrofoska verde a concentraciones del 0,0025%, 0,005% y 0,01%; y suero
de leche a concentraciones del 0.1%, 0.5% y 1.0%. La agitación se realizó mediante la
inyección de aire difuso, y la radiación fue artificial, con fotoperiodo de doce horas diarias.
La mayor producción de Biomasa fue obtenida en el medio de cultivo de Nitrofoska verde a
una concentración de 0,005%, con 0,8333 g/L. Asimismo se observó que las microalgas se
adaptaron más rápidamente a los medios de cultivo con menor concentración de nutrientes.";2019
Universidad César Vallejo;Efecto de la sustitución parcial de grenetina por harina de cushuro (Nostoc commune vauch) sobre las características nutricionales y físicas de gomitas comestibles a base de arándano (Vaccinium myrtillus);García Bartra, Sweeney Kahomy;Ingeniera Agroindustrial;Pagador Flores, Sandra Elizabeth;"El presente trabajo de investigación tuvo por objetivo la evaluación del efecto de la
sustitución parcial de grenetina por harina de cushuro (Nostoc commune vauch) sobre las
características nutricionales y físicas de gomitas comestibles a base de arándano (Vaccinium
myrtillus). Se realizaron 3 porcentajes de sustitución teniendo como T1 al 35 %, T2 al 45%
y T3 al 55% de sustitución de harina de cushuro al cual se le realizó las características
nutricionales dando como resultado un 3.1433 % de proteínas, 0.146 % de cenizas, 10.026
% de grasa, 74.442 % de carbohidratos, aportando 400.584 Kcal por cada 100 g, con un
aporte de antioxidantes en un 54.616%, para el tratamiento 1, un 3.180 % de proteínas,
0.0780 % de cenizas, 4.884 % de grasa, 78.422 % de carbohidratos, aportando 320.371 Kcal
por cada 100 g, con un aporte de antioxidantes en un 58.951%, para el tratamiento 2, un
3.457 % de proteínas, 0.398 % de cenizas, 3.709 % de grasa, 82.284 % de carbohidratos,
aportando 376.35 Kcal por cada 100 g, con un gran aporte de antioxidantes en un 66.646%,
para el tratamiento 3, en cuanto a las características físicas se obtuvo para el tratamiento
1: 0.801 N de fuerza a la compresión, con una humedad de 12.24 % y en cuanto a color con
una luminosidad de L* 33.706, a*0.8467, b*0.01, c*0.8467 y ΔE de 1.845, en el
tratamiento 2: 0.464 N de fuerza a la compresión, con un porcentaje de humedad en 13.434
% y en cuanto a color con una luminosidad de L* 33.713, a*0.446, b*0.116, c*0.463y ΔE
de 1.432 y por último para el tratamiento 3: 0.316 N de fuerza a la compresión, con un
porcentaje de humedad en 10.150 % siendo este el más bajo y en cuanto a color presenta una
luminosidad de L* 28.48, a*0.7, b*0.773, c*1.0433 y ΔE de 2.2435. En conclusión, se
obtuvieron mejores características fisicoquímicas con el tercer tratamiento (55%) en las
gomitas comestibles a base de cushuro (Nostoc commune vauch) y arándano (Vaccinium
myrtillus), por otro lado, el tratamiento 1 (35%) presentó mejores resultados en cuanto a
características físicas.";2020
Universidad César Vallejo;Efecto de la concentración del mucílago de Linaza (Linum usitatissimum) sobre las  características fisicoquímicas y reológicas de un Néctar de Maracuyá (Passiflora edulis);Silva Muñoz, José Segundo;Ingeniera Agroindustrial;Pagador Flores, Sandra Elizabeth;"El presente trabajo de investigación tuvo por finalidad determinar el efecto de
concentración del mucílago de Linaza (Linum usitatissimum) sobre las características
fisicoquímicas y reológicas de un Néctar de Maracuyá (Passiflora edulis)”.
Primero se extrajo el mucílago de Linaza en polvo en una relación de 1:9 de semilla y
agua, a una temperatura de 85°C por un lapso de agitación de 15 minutos para su posterior
liofilización. Luego en la elaboración del Néctar se trabajó con 4 tratamientos, dentro de
estos un Blanco (CMC) y los otros 3 con mucílago de Linaza a diferentes concentraciones
(T1 – 0.05%, T2 – 0.10% y T3 – 0.15%), una vez conseguido el producto terminado se
caracterizó fisicoquímicamente y se analizó estadísticamente mediante un análisis de
varianza (Anova) y la prueba de Tukey, la cual reportó un efecto muy significativo entre
todos los tratamientos de los análisis de sedimentación, humedad y cenizas.
Los tratamientos no presentaron variabilidad en el análisis de °brix, ph y acidez con la
cual se determina que el mucílago de Linaza no influye en la calidad del producto
terminado. 
Sin embargo, en la estabilidad del Néctar de Maracuyá, el tratamiento T3 (0.15%
mucílago) obtuvo 34.30%, reflejando el mejor resultado en cuanto a la sedimentación y
así mismo en solidos totales obtuvo 14.42%; si bien la cantidad del mucílago de Linaza
no contribuye a alterar la calidad (ph, acidez y °Brix), pero si influye en una mejor
estabilización del Néctar.
Por último el tipo de fluido del Néctar de Maracuyá es de tipo Pseudoplástico, para el
índice de comportamiento de flujo obtuvo 0.6808, para el índice de consistencia obtuvo
0.2855 y para el umbral de fluencia de 0.2767.";2019
Universidad César Vallejo;Efecto del secado previo y tiempo de fritura en las características fisicoquímicas y aceptabilidad sensorial de  hojuelas  de papa frita (solanun tuberosun)  variedad yungay;Santisteban Crespin, Manuel Mercedes;Ingeniero Agroindustrial;León Marrou, María Elena;"El presente trabajo de investigación tuvo por objetivo evaluar el efecto del secado previo
y tiempo de fritura en las características fisicoquímicas y aceptabilidad sensorial de
hojuelas de papa frita (Solanum Tuberosum) variedad Yungay.  
Los resultados reportaron que existieron diferencias significativas (p&lt;0,5) del efecto del
secado (60% y 80% de humedad inicial y tiempos de fritura) (2,0; 2,5 y 3,0 min) sobre
el % de humedad final, % de absorción de aceite y aceptabilidad sensorial de hojuela de
papa frita (Solanum Tuberosum) variedad Yungay. 
Las muestras con secado previo (60% de humedad inicial) reportaron un tiempo de
fritura de 2 minutos un menor % de absorción de aceite de 14,53% y 4.27 de humedad
final. 
Las muestras de hojuelas con 80% de humedad son las que reportaron mayor
aceptabilidad sensorial con respecto al color (2,0 min de fritura) y crocantes (3,0 min de
fritura)";2019
Universidad César Vallejo;Efecto de la concentración de la Harina de Chía (salvia hispanica  l.) sobre las características fisicoquímicas y sensoriales de nuggets a base de trucha (oncorhynchis mykiss) en el Departamento  de La Libertad Provincia de Trujillo en el año 2019;Silva Muñoz, José Segundo;Bachiller en Ingeniería Agroindustrial;Pagador Flores, Sandra Elizabeth;"La utilización del pescado la Trucha como sustituto de la carne de Pollo en productos
industrializados, se encuentran en auge. Su utilidad en productos como los Nuggets
favorecerá un novedoso alimento nutritivo y sobretodo un buen uso del mismo. El
objetivo general de esta investigación fue Determinar el efecto de la concentración de
harina de Chía (Salvia hispánica L.), sobre las características fisicoquímicas y sensoriales
de Nuggets a base de Trucha (Oncorhynchis mykiss). En los resultados se muestran el
análisis sensorial se observó que en aceptabilidad de los Nuggets, la formulación 12
obtuvo mayor aceptabilidad entre los consumidores, además en las características
fisicoquímicas, solo se analizó la mejor formulación, en este caso solo fue analizada la
formulación 12, en donde el porcentaje de grasa encontrado mediante el método del
Soxhlet en los Nuggets de Trucha, es menor en comparación a los datos obtenidos en los
supermercados de Nuggets de Pollo y la cantidad de proteína se halló de forma cualitativa
mediante el método de Biuret, donde el color aumentó debido a la gran cantidad de 
proteínas de una formulación a otra.";2019
Universidad César Vallejo;Efecto de la sustitución parcial de Harina de Trigo (triticum aestivum) por Harina de Kiwicha (amaranthus caudatus) en la elaboración de galletas nutritivas, Trujillo, abril - julio, 2019;Crisologo Bueno, Carlos Fernando;Bachiller en Ingeniería Agroindustrial;Pagador Flores, Sandra Elizabeth;"El presente trabajo de investigación denominado efecto de la sustitución parcial de harina
de trigo (Triticum aestivum) por harina de kiwicha (Amaranthus caudatus) en la
elaboración de galletas nutritivas, Trujillo, abril - julio, 2019. Se consideraron como
objetivo general evaluar el efecto de la sustitución parcial de harina de trigo (Triticum
aestivum) por harina de kiwicha (Amaranthus caudatus) en la elaboración de galletas
nutritivas, y como objetivos específicos determinar la textura de galletas nutritivas,
determinar la composición proximal de galletas nutritivas y determinar la aceptabilidad
general de galletas nutritivas. Las muestras fueron tomadas al azar, considerando 4
tratamientos con 3 réplicas cada uno. Se elaborarán las siguientes formulaciones, T0:
100% - 0%, T1: 90% - 10%, T2: 85% - 15%, T3: 80% - 20%, de harina de trigo y harina
de kiwicha respectivamente. Se logró concluir que la sustitución parcial de harina de trigo
por harina de kiwicha efecto significativamente en la composición proximal y textura en
las galletas nutritivas.";2019
Universidad César Vallejo;Efecto de la sustitución de harina de trigo por Harina de Cañihua (chenopodium pallidicaule allen) y Kiwicha (amaranthus caudatus)  en las características fisicoquímicas y calidad culinaria de fideos fetuccini;Tantarico Huamán, Yeiser Jeferson.;Bachiller en Ingeniería Agroindustrial;Pagador Flores, Sandra Elizabeth;"En esta investigación de sustitución de harinas en la elaboración de pastas, son alimento muy
consumido y elaborado en base a harina de trigo. En este estudio se buscó incluir las harinas
de Cañihua y kiwicha, para elaboración de fideos tipo fetuccini para ser evaluados en sus
características fisicoquímicas y calidad culinaria; para ello se realizó una metodología
experimental utilizado muestra control con tres replicas (15% Cañihua,15% Kiwicha; 30%
Cañihua y 30% Kiwicha), tomando como base la harina de trigo. El efecto de la sustitución
generó en los análisis fisicoquímicos diferencias estadísticamente significativas en cuanto al
% humedad, cenizas, acidez alcohólica y color, esto respecto a la muestra control; por otra
parte, las calidades culinarias en fideos con sustitución no superaron a la muestra control del
100% de trigo. Concluyéndose que incluir cereales andinos mejora las cualidades nutritivas,
pero no superan la calidad culinaria de los fideos convencionales.";2019
Universidad César Vallejo;Efecto de la proporción de Pulpa de Arándano (vaccinium corymbosum) variedad biloxi: Pulpa de Fresa (fragaria vesca)  variedad chandler: Jugo de Uva (vitis vinífera) variedad Italia sin pepa, en las características fisicoquímicas y sensoriales  de un jugo mixto de frutas;Alva Bernal, Kevin Pierre Gustavo;Ingeniero Agroindustrial;Barraza Jáuregui Gabriela del Carmen;"Se evaluó el efecto de la proporción de pulpa de arándano: pulpa de fresa: jugo de uva en las
características fisicoquímicas y sensoriales de un jugo de frutas.  
Se trabajó con un Diseño de un solo factor utilizando para cada uno de los tratamientos, 3
repeticiones. 
El análisis Check-all-that-apply (CATA), correspondió que 4 productos sean evaluados (1 es
ideal y 3 son regulares) por 83 degustadores por medio de 24 atributos. Se registraron los
resultados de forma binaria (0: atributo no escogido; 1: el atributo escogido). Cabe mencionar,
que cada uno de los consumidores  otorgó un calificativo general (1-9) a cada producto (menos
el ideal). 
Se realizó la prueba Q de Cochran para determinar diferencias entre los productos para cada una
de los atributos considerados en la pregunta CATA. Además se evaluó, a partir de sus perfiles
sensoriales, la prueba de la no dependencia entre las columnas y filas en los productos. Se obtuvo
un mapa sensorial (biplot de atributos y productos) utilizando el análisis de correspondencia
(CA) considerando las distancias Chi-cuadrado, para determinar que productos y atributos
estuvieron vinculados al ideal, seguido de un análisis de coordenadas principales que se
visualizaron en un mapa bidimensional, para determinar la asociación del gusto con los
atributos, luego se efectuó un análisis de penalización sobre las respuestas de las preguntas
CATA considerando la descripción del producto ideal y se determinó las caídas del gusto
relacionada con el desvío del producto ideal para cada término utilizado en la pregunta CATA
y se sometieron a pruebas de significación.  
El método CATA determinó que los atributos principales que un consumidor desea para su jugo
mixto ideal son: sabor dulce y muy consistente.";2018
Universidad César Vallejo;Propuesta de mejora para incrementar la productividad en el proceso de  Selección y Clasificación de Espárrago Blanco (Asparagus Officinalis L.)  de la empresa Green Perú S.A.;Lozano Velásquez, Esther Marianela;Ingeniera Agroindustrial;Linares Luján, Guillermo Alberto;"El presente proyecto de tesis tiene como objetivo principal la propuesta de mejora para
incrementar la productividad en el proceso de selección y clasificación de esparrago blanco
de la empresa Green Perú S.A.; utilizando herramientas como el estudio de tiempos y
movimientos, mediante el uso de la observación directa y secuencial del proceso para
determinar el diagrama de flujo, diagrama de Gantt, balance de línea, diagrama de recorrido,
flujo de materiales y análisis matricial del proceso productivo del espárrago blanco.
Mediante las herramientas de disposición de planta se logra tener una visión preliminar del
proceso, construyendo una base para la identificación de las oportunidades de mejora que
incrementen la productividad del proceso. Dentro de las propuestas de mejora se tomaron
algunas alternativas tales como: la eliminación del corte de materia prima, la reubicación de
la balanza electrónica (donde se pesa el producto seleccionado), la reubicación del producto
seleccionado en la cámara de producto terminado (01), la implementación de una segunda
puerta para el despacho del producto seleccionado y salida del personal, el retiro de las mesas
y cajas de acero inoxidable (usadas para la operación de corte mecánico) y el
acondicionamiento de 6 líneas de selección y clasificación en la misma sala de proceso.
Luego se realizó un nuevo análisis con las mismas herramientas de la disposición de planta
teniendo en cuenta las propuestas planteadas y así poder determinar si  existe el incremento
de la productividad en el proceso de selección y clasificación del esparrago blanco.";2019
Universidad César Vallejo;Efecto de la concentración de carboximetilcelulosa sobre las características reológicas y  aceptabilidad general en pulpa de guanábana (annona muricata l.);Espejo García, Nathaly Cecilia Taella;Ingeniera Agroindustrial;Linares Lujan, Guillermo Alberto;"Para la ejecución de esta investigación se tomó como meta medir el efecto de la cantidad exacta 
de carboximetilcelulosa en aceptación general en pulpa de guanábana y determinar las
características reológicas en diferentes concentraciones de CMC. Para hallar la reología se
empleó un reómetro modelo Brookfield RVDV – III realizándose 9 muestras experimentales para
evaluar las variables “m” (índice de consistencia), “n” (índice de comportamiento de flujo) y To
(esfuerzo cortante inicial) en porcentajes de 0.1%, 0.2% y 0.3% en  concentración de
carboximetilcelulosa y la aceptabilidad general en una evaluación con escala hedónica en el
rango de 10=Me gusta mucho a 2= Me disgusta mucho. La evaluación para la aceptación general
se necesitó un grupo no especializado de 50 consumidores de pulpa de guanábana. Se
determinó que las concentraciones de CMC tiene un efecto sobre la viscosidad y aceptación
general, determinando que la cantidad al 0.2% tiene mejor aceptación general.";2019
Universidad César Vallejo;Efecto de la concentración de microorganismos eficaces (EM-1) en el crecimiento de plantones de maracuyá (Passiflora edulis f. flavicarpa);Núñez Vázquez, Raúl Alonzo;Ingeniero Agroindustrial;Pagador Flores, Sandra Elizabeth;"En el presente trabajo de investigación se evaluó el efecto de la concentración de los
microorganismos eficaces, en el crecimiento de plantones de maracuyá (Passiflora edulis f.
flavicarpa), para lo cual se evaluó la altura y largo de las hojas, además de realizar un
conteo de microorganismos eficaces (EM-1) y microorganismos eficaces activados
(EMA); a través del método de recuento en placa. Los plantones fueron clasificados en
cuatro bloques completamente al azar (A, B, C y D); los resultados en cuanto a la altura de
planta (cm) a los 15 días de la primera aplicación de EM-1 en concentraciones de (0%, 5%,
10% y 15%) fueron de 5.91±0.76, 6.04±0.53, 6.98±0.37 y 7.41±0.35; a los 30 dias fueron
de 7.68±0.60, 7.77±0.70, 8.84±0.37 y 9.79±0.49; a los 45 días fueron de 9.66±0.80,
9.81±0.67, 11.42±0.16 y 12.54±0.72; y por último a los 60 días fue de 11.67±0.46,
12.19±0.41, 13.39±0.36 y 15.56±0.94 para las cuatro concentraciones respectivamente; en
cuanto a los resultados del largo de la hoja (cm) evaluados a los 60 días de la primera
aplicación de EM-1 fueron de 5.87±0.52, 7.03±0.42, 8.59±0.70 y 10.06±0.58; a estos
resultados se aplicó un análisis de varianza (ANVA) y posteriormente una prueba de
Tukey, determinándose que existió efecto significativo de la concentración de EMA sobre
el crecimiento de los plantones (p&lt;0.05), además de existir diferencias significativas entre
tratamientos, siendo la concentración de 15% la que presentó un mayor promedio de la
altura de la planta y largo de hoja a los 60 días de la primera aplicación de EMA. La
cantidad de microorganismos presentes en el EM-1 fue de 27x10 5  UFC/mL y en el EMA
(microorganismos eficaces activados) fue de 29 x 10 7 UFC/mL";2018
Universidad César Vallejo;"Efecto de la temperatura y tiempo de almacenamiento en
la pérdida de peso, contenido antocianinas y capacidad
antioxidante de arándano azul (Vaccinium corymbosum
L.) variedad Biloxi";Sandoval Quispe, Llely Del Pilar;Ingeniera Agroindustrial;Barraza Jáuregui Gabriela del Carmen y Pagador Flores, Sandra Elizabeth;"Esta investigación tuvo como objetivo determinar el efecto de la temperatura y
tiempo de almacenamiento en la pérdida de peso, contenido de antocianinas y
capacidad antioxidante del arándano azul (Vaccinium corymbosum L.) variedad
Biloxi, proveniente de la provincia de Chao, La Libertad. Los arándanos azules
fueron envasadas en bandejas de polietileno y almacenadas a dos temperaturas
(1 y 7 °C) durante 7, 14 y 21 días. Se cuantificó pérdida de peso y contenido de
antocianinas, por metodología de pH diferencial y capacidad antioxidante, medida
como IC50. La prueba estadística de Tukey, determinó que la temperatura y
tiempo de almacenamiento tuvieron un efecto significativo (p&lt;0.05) en relación
con  la pérdida de peso y contenido de antocianinas de arándano azul; a
diferencia de la capacidad antioxidante donde reportó un efecto significativo en el
tiempo de almacenamiento y que la mejor conservación es con la temperatura
más baja (1°C) y el tiempo de almacenamiento más corto (7 días) obteniendo una
pérdida de peso de  4,83, un contenido total de antocianinas de 159,22 mg/100g 
cianidina-3-glucósido  y una capacidad antioxidante de 7.54.";2018
Universidad César Vallejo;Efecto de la relación muestra: solvente en el rendimiento de extracción de acetogeninas presentes en la hoja de la Guanábana (annona muricata), provincia de Ascope, La Libertad;Reyna Pereda, Segundo Manuel;Ingeniero Agroindustrial;Cruz Escobedo, Antis Jesús;"En el presente trabajo se determinó el efecto de la relación muestra: solvente en el rendimiento de extracción de acetogeninas presentes en la hoja de guanábana de la Provincia de Ascope, La Libertad; el método realizado fue por decantación utilizando diclorometano, hexano y metanol como solventes, las concentraciones trabajadas fueron de (1:4),(1:5),(1:6),(1:7),(1:8); los análisis realizados se hicieron por triplicado para cada muestra ; para identificar el compuesto de interés se utilizó el método de cromatografía de capa fina y como revelador el reactivo de kedde; obteniendo mayor rendimiento de  acetogenina  en la concentración (1:4) con un 5.016% de acetogenina.";2018
Universidad César Vallejo;Efecto de Tecnologías Combinadas sobre las  características Físico-Químicas y Microbiológicas de Encurtidos de Pimiento Piquillo (Capsicum Annuum, L.)  Variedad Piquillo durante el Tiempo de Almacenamiento;Alfaro Alarcón, Anthony Jorell;Ingeniero Agroindustrial;Pagador Flores, Sandra Elizabeth;"El presente trabajo de investigación tuvo por objetivo evaluar el efecto de
tecnologías combinadas sobre las características físico-químicas y
microbiológicas de encurtidos de pimiento piquillo (Capsicum annuum, L.)
Variedad piquillo durante el tiempo de almacenamiento, para lo cual se empleó un
Diseño experimental con un total de 16 tratamientos los cuales fueron replicados
tres veces teniendo un total de 48 unidades experimentales, determinando el pH,
acidez (%) y recuento de mohos y levaduras evaluados a 0, 4, 8, 12, 16, 20, 25 y
30 días de almacenamiento. Se aplicó un análisis de varianza (ANOVA). Se
observaron diferencias significativas en la determinación de pH, acidez (%) y
recuento de mohos y levaduras ufc/g (p&lt;0,05); obteniendo resultados que el
efecto del pH en encurtido de pimiento piquillo fue que el tratamiento con
tecnologías combinadas presentó menor variación del pH de 3.75 a 3.81 al día 30
de almacenamiento, para el caso de la muestra control (Sin tecnología
combinada) el pH presentó mayor variación de 3.76 a 3.94, el mismo
comportamiento ocurrió en la acidez (%), donde se obtuvo que el tratamiento con
tecnologías combinadas presento menor variación de la acidez de 1.23 a 1.16% al
día 30 de almacenamiento, para el caso del control (Sin tecnología combinada) la
acidez presentó mayor variación de 1.24 a 1.09%. Con respecto al recuento de
mohos y levaduras en encurtido de pimiento piquillo fue que el tratamiento con
tecnologías combinadas presentó 0 ufc/g durante los 30 días de almacenamiento,
para el caso del control (Sin tecnología combinada) el recuento de mohos y
levaduras presentó  variación de 0  a 1.7x10² ufc/g. En conclusión se determinó
que el tratamiento que presentó mejores resultados respecto a la variación del pH,
acidez (%) y recuento de mohos y levaduras ufc/g en encurtido de pimiento
piquillo fue el uso de tecnologías combinadas durante 30 días de
almacenamiento.";2018
Universidad César Vallejo;Efecto De La Temperatura Y Tiempo De Tratamiento Térmico Sobre El Valor Pasteurizador, Porcentaje  De Retención De Carotenoides Y Aceptabilidad General De Néctar De Aguaymanto (Physalis Peruviana L).;Paiva Farías, Mabeli Susan;Ingeniera Agroindustrial;Pagador Flores, Sandra Elizabeth;"El presente trabajo de investigación tuvo como objetivo evaluar el efecto de la temperatura
y tiempo de tratamiento térmico sobre el valor pasteurizador, porcentaje de retención de
carotenoides y aceptabilidad general de un néctar de aguaymanto (Physalis peruviana L.)
para garantizar la letalidad del microorganismo de referencia presente en el néctar así como
también la obtención del mayor porcentaje de retención de carotenoides del néctar de
aguaymanto (Physalis peruviana L) .  
Para el cumplimiento de este objetivo se trabajo con un diseño bifactorial (3 temperaturas y
3 tiempos), con 3 repeticiones. Para las variables paramétricas: valor pasteurizador y
retención de carotenoides, se realizó un análisis de varianza (ANVA), y a continuación, al
existir diferencias significativas (p&lt;0.05) se aplicó la prueba de comparaciones múltiples de
Duncan la cual comparó los resultados mediante la formación de subgrupos y se determinó
de esta manera el mejor tratamiento. Para la variable no-paramétrica aceptabilidad general,
se aplicó la prueba de Friedman. 
Se utilizó  aguaymanto (Physalis peruviana L.), procedente de la provincia de Cajamarca,
adquiridos en el Mercado “La Unión” de Trujillo, en buen estado sin presencia de daños
físicos o microbiológicos, fueron procesados y envasados en frascos de vidrio, siendo
tratados térmicamente en un baño maría a temperaturas de 75°C, 85°C y 95°C por el tiempo
de 5’, 10’ y 15’cada una. Finalmente se determinó que el mejor tratamiento para garantizar
la letalidad del microorganismo de referencia Byssochlasmy fulva fue de 85°C x 5’ con un
valor pasteurizador de 0.18’ y un porcentaje de retención de carotenoides de 79.24%. asi
como también se determinó que el néctar de aguaymanto (Physalis peruviana L.) si tiene
aceptabilidad por el público.";2018
